{
  "$schema": "http://json-schema.org/draft-07/schema#",
  "$id": "https://osf-schemas/next/validation/profile-unified-schema.json",
  "title": "OSF SM Profile — next/ unified meta-schema (ONE standard for machine | equipment | business) — v2.0 (v2.0: one entity-profile standard; OPC binding nested under isa95; empty semantics allowed)",
  "description": "Single source of truth for every next/profiles/**/*.json EXCEPT intelligence/ (which keeps the canonical standard/validation/intelligence-profile-schema.json). Merges the formerly-separate machine-/equipment-/business-profile-schema.json (which were ~90% identical) into one base + draft-07 if/then branches keyed on the now-REQUIRED 'category'. The base accepts the UNION of properties all three categories use, so additionalProperties:false still passes every existing next/ profile. Skeleton-first: every build-later block may be EMPTY (attributes [], relationships [], constraints {}, kpiRefs [], semantics absent) so a customer can commit an identity-only skeleton and fill it in later. Cross-reference resolution (predicate.attr -> attributes[].name; predicate.value type vs attribute.dataType) is still enforced separately by next/ci/lint-constraints.mjs (JSON Schema cannot express it); category<->folder placement by next/ci/lint-category.mjs.",
  "type": "object",
  "required": [
    "profileId",
    "version",
    "displayName",
    "category"
  ],
  "properties": {
    "_comment": {
      "type": "string",
      "description": "Optional doc/meta key (e.g. demo/example/skeleton fixtures). Ignored by consumers."
    },
    "_example": {
      "type": "boolean",
      "description": "Optional meta flag: marks this as an example/demo/skeleton fixture, not a canonical profile."
    },
    "profileId": {
      "type": "string",
      "pattern": "^SMProfile-[A-Za-z0-9][A-Za-z0-9-]+$"
    },
    "version": {
      "type": "string",
      "pattern": "^[0-9]+\\.[0-9]+\\.[0-9]+$"
    },
    "standard": {
      "type": "string",
      "enum": [
        "CESMII",
        "OSF",
        "ISA-95",
        "ISA-88"
      ]
    },
    "displayName": {
      "type": "string"
    },
    "category": {
      "type": "string",
      "enum": [
        "machine",
        "equipment",
        "business",
        "material",
        "quality"
      ],
      "description": "REQUIRED. Selects the per-category if/then branch. 'machine' = OT asset profile (edge-polled OPC). 'equipment' = ISA-88 physical equipment master-data anchor. 'business' = IT/MOM information object (it-edge-polled). 'material' = a material lot or sublot, 'quality' = a test result or quality analysis: ISA-95 objects of their own, carried like 'business' (customer reference-concept 25.09.). intelligence/ profiles use a different (canonical) schema and are out of scope here."
    },
    "description": {
      "type": "string"
    },
    "parentType": {
      "type": [
        "string",
        "null"
      ]
    },
    "abstract": {
      "type": "boolean"
    },
    "kpiRefs": {
      "type": "array",
      "items": {
        "type": "string"
      },
      "description": "Skeleton-first: [] is valid."
    },
    "attributes": {
      "type": "array",
      "description": "Skeleton-first: [] is valid (no minItems). The union of attribute facets across all three categories; per-category extras (polling for machine; isKey/isId for equipment+business) are gated by the if/then branches below.",
      "items": {
        "type": "object",
        "required": [
          "name",
          "dataType",
          "delivery",
          "scope",
          "promotion"
        ],
        "properties": {
          "name": {
            "type": "string"
          },
          "dataType": {
            "type": "string",
            "enum": [
              "String",
              "Int32",
              "Int64",
              "Float",
              "Double",
              "Boolean",
              "DateTime",
              "Json"
            ]
          },
          "category": {
            "type": "string"
          },
          "required": {
            "type": "boolean"
          },
          "description": {
            "type": "string"
          },
          "enum": {
            "type": "array"
          },
          "unit": {
            "type": "string",
            "description": "UNECE Rec. 20 code (standard/validation/unece-codes.json), e.g. CEL, BAR, MMT, P1. Required on numeric attributes unless declared in standard/validation/open-units.json. Checked by ci/lint-units.mjs."
          },
          "valueType": {
            "type": "string",
            "enum": ["PV", "SP", "ID", "LIM", "MD"],
            "description": "What kind of value: PV measured/actual (IST), SP commanded/planned (SOLL), ID identifier or reference, LIM enforced bound, MD master data. Declared where the repo implies it (Act_/Set_/Plan_ prefixes, Setpoint, recipe targets, kgIdProperty, *_ref); never guessed. ci/lint-value-type.mjs."
          },
          "currency": {
            "type": "string",
            "description": "ISO 4217 currency code for monetary attributes (EUR). Currencies are not UNECE units."
          },
          "delivery": {
            "type": "string",
            "enum": [
              "telemetry",
              "transactional"
            ]
          },
          "scope": {
            "type": "string",
            "enum": [
              "edge",
              "hub"
            ]
          },
          "promotion": {
            "type": "string",
            "description": "Emission cadence (edge-agnostic; the IT and OT edges honor it identically). Kept enum: raw | aggregate | on_change | on_cycle_end | on_event | never. PLUS interval tokens matching ^[0-9]+(sec|min)$ (canonical Nsec/Nmin, N>=1) for periodic emission. never = stays in the payload/snapshot but is excluded from the change-trigger and never published on its own.",
            "oneOf": [
              {
                "enum": [
                  "raw",
                  "aggregate",
                  "on_change",
                  "on_cycle_end",
                  "on_event",
                  "never"
                ]
              },
              {
                "pattern": "^[0-9]+(sec|min)$"
              }
            ]
          },
          "polling": {
            "type": "string",
            "description": "machine-category only (gated by the if/then branch) — OPC poll mode (e.g. 'scan')."
          },
          "isKey": {
            "type": "boolean",
            "description": "equipment/business-category only (gated) — natural/business key column."
          },
          "isId": {
            "type": "boolean",
            "description": "equipment/business-category only (gated) — primary id column."
          },
          "quality": {
            "$ref": "#/definitions/quality"
          },
          "semantics": {
            "$ref": "#/definitions/semantics"
          },
          "counter": {
            "$ref": "#/definitions/counter"
          }
        },
        "additionalProperties": false
      }
    },
    "relationships": {
      "type": "array",
      "description": "Skeleton-first: [] is valid.",
      "items": {
        "type": "object",
        "required": [
          "type",
          "target"
        ],
        "properties": {
          "type": {
            "type": "string"
          },
          "target": {
            "type": "string"
          },
          "targetIdProp": {
            "type": "string"
          }, "resolvedBy": {"enum": ["instances"], "description": "The target is an equipment level (instance-schema equipmentLevel) and the edge resolves through the partOf chain of sites/<site>/instances; no targetIdProp then (Welle 8, customer reference-concept 25.09.)."},
          "timeBounded": {
            "type": "boolean"
          },
          "description": {
            "type": "string"
          }
        },
        "additionalProperties": false
      }
    },
    "constraints": {
      "type": "array",
      "description": "Merged standard: array of constraint objects (each with a stable 'name'). Consistent with attributes[]/relationships[]. Optional/next-facet; [] or absent is valid.",
      "items": {
        "type": "object",
        "required": [
          "name"
        ],
        "properties": {
          "name": {
            "type": "string"
          }
        },
        "additionalProperties": true
      }
    },
    "isa95": {
      "type": "object",
      "description": "ISA-95/MOM/ISA-88 mapping. Loosely typed on purpose — the equipment/operations model is evolving; deep semantics are reviewed (lint), not schema-pinned. The 'objectModel' key is REQUIRED for category=equipment|business (gated by the if/then branches); for category=machine it is optional.",
      "properties": {
        "objectModel": {
          "type": "string",
          "minLength": 1
        },
        "momDomain": {
          "type": "string"
        },
        "level": {
          "type": "integer"
        },
        "extension": {
          "type": "boolean"
        },
        "equipmentLevel": {
          "type": "string",
          "description": "Same list as intelligence-profile-schema.json: the ISA-88 levels of standard/validation/naming-standard.md plus the ISA-95 Part 2 role-based equipment types.",
          "enum": ["Enterprise", "Site", "Area", "ProcessCell", "EquipmentUnit", "EquipmentModule", "ControlModule", "ProductionLine", "WorkCell", "ProductionUnit", "StorageZone", "StorageUnit", "WorkCenter", "WorkUnit"]
        },
        "equipmentClass": {
          "type": "string"
        },
        "note": {
          "type": "string"
        },
        "propertyMap": {
          "type": "object"
        }
      },
      "additionalProperties": true
    },
    "semantics": {
      "$ref": "#/definitions/semantics"
    },
    "kgNodeLabel": {
      "type": "string"
    },
    "kgIdProperty": {
      "type": "string"
    },
    "retired": {
      "type": "boolean",
      "description": "Profile-level tombstone. true = the profile is kept for history but nothing may bind it: no source may reference it and no node/edge may be created from it. Mirrors the constraint-level retirement vocabulary."
    },
    "retiredAt": {
      "type": "string",
      "description": "ISO date the profile was retired."
    },
    "retirementId": {
      "type": "string",
      "description": "Stable id of the retirement, e.g. retired:SMProfile-CustomerOrder@2026-08-13."
    },
    "retiredBy": {
      "type": "string"
    },
    "retiredReason": {
      "type": "string",
      "description": "Why, with the measurement that decided it."
    },
    "retiredEvidence": {
      "type": "object",
      "description": "The numbers the retirement rests on."
    }
  },
  "additionalProperties": false,
  "allOf": [
    {
      "comment": "machine: allow polling/companionSpec/opcuaTypeDefinition/deviceClass + enforce promotion:'raw' => scope:'edge'.",
      "if": {
        "properties": {
          "category": {
            "const": "machine"
          }
        },
        "required": [
          "category"
        ]
      },
      "then": {
        "properties": {
          "attributes": {
            "items": {
              "allOf": [
                {
                  "comment": "machine attributes must not use the equipment/business isKey/isId facets.",
                  "not": {
                    "anyOf": [
                      {
                        "required": [
                          "isKey"
                        ]
                      },
                      {
                        "required": [
                          "isId"
                        ]
                      }
                    ]
                  }
                },
                {
                  "comment": "promotion 'raw' is edge-only.",
                  "if": {
                    "properties": {
                      "promotion": {
                        "const": "raw"
                      }
                    }
                  },
                  "then": {
                    "properties": {
                      "scope": {
                        "const": "edge"
                      }
                    }
                  }
                }
              ]
            }
          }
        }
      }
    },
    {
      "comment": "equipment & business: require isa95.objectModel; allow isKey/isId on attributes; forbid the machine-only OPC facets.",
      "if": {
        "properties": {
          "category": {
            "enum": ["equipment", "business", "material", "quality"]
          }
        },
        "required": [
          "category"
        ]
      },
      "then": {
        "required": [
          "isa95"
        ],
        "properties": {
          "isa95": {
            "required": [
              "objectModel"
            ]
          },
          "attributes": {
            "items": {
              "not": {
                "required": [
                  "polling"
                ]
              }
            }
          }
        }
      }
    }
  ],
  "definitions": {
    "counter": {
      "type": "object",
      "description": "CAPT-ZUG4 (2026-07-12) — READING SEMANTICS for an attribute whose value is a RUNNING TOTAL, not a measurement. Absent = the value is a measurement and may be averaged. Present = it may NOT: mean/sigma/Cp over a counter are arithmetic on a ramp, and min/max over a counter silently hand the caller `max - min`, which is the wrong answer the moment the counter resets.\n\nWHY THIS IS A CONTRACT FIELD AND NOT A COMMENT. Until now the only place this fact was written down was the attribute's `description` prose ('Good parts produced (cumulative).'). No consumer can read prose. That is EXACTLY the defect that killed qty_shortfall: its guard literal 'offen' was copied from a description that had been invented rather than measured, the code did the opposite of the stated intent, and the rule shipped 11.196 phantom findings and EUR 1.737.072 of phantom impact. A semantic that only humans can see is a semantic the machine will get wrong. So it moves into the contract, where the linter and the edge can both read it.\n\nMEASURED, not assumed (sgm-004 edge TS `uns_history`, full history to 2026-07-12): the sim does not persist its counters, so every container restart sets them back to 0. `good` reset 10 times. Read naively, max-min says 55.622 parts. Read as the sum of positive increments it is 125.210 — the naive answer loses 56 % of the factory's output. The reset-aware reading is confirmed by an INDEPENDENT identity that only holds if it is right: good 125.210 + scrap 1.742 = 126.952 = total 126.952 = 8 cavities x shotCount 15.869, exactly.",
      "required": [
        "semantics",
        "aggregation"
      ],
      "properties": {
        "semantics": {
          "type": "string",
          "description": "cumulative_resettable = a running total that CAN return to zero (device restart, shift/tool reset, 32-bit wrap). cumulative_monotonic = a running total that provably never resets (assert this only if measured — a wrong assertion here is a silent 2x error). delta = the value is already the increment for its interval and must simply be summed. unreadable = it IS a running total, but which entity it belongs to is NOT established, so no reading is correct yet; pair it with aggregation:'refuse'. 'unreadable' is a first-class, honest state — it exists so that 'we do not know' can be SAID in the contract instead of being papered over with a plausible default.",
          "enum": [
            "cumulative_resettable",
            "cumulative_monotonic",
            "delta",
            "unreadable"
          ]
        },
        "aggregation": {
          "type": "string",
          "description": "How a consumer MUST turn samples of this attribute into a quantity over a window. sum_of_positive_deltas = sum(greatest(v - lag(v), 0)) — the only reading that survives a reset. last_minus_first = valid ONLY for cumulative_monotonic. sum = valid only for `delta` semantics. refuse = the engine MUST NOT aggregate this attribute at all and must report an evidence gap instead of a number. A refusal that is written down is worth more than a number nobody can defend.",
          "enum": [
            "sum_of_positive_deltas",
            "last_minus_first",
            "sum",
            "refuse"
          ]
        },
        "resetsObserved": {
          "type": "integer",
          "minimum": 0,
          "description": "Evidence, not configuration: how many resets were actually MEASURED in the historian at the date named in `measuredAt`. 0 with semantics=cumulative_resettable is legitimate (it can reset, it just has not yet); it is not a licence to switch to last_minus_first."
        },
        "measuredAt": {
          "type": "string",
          "format": "date",
          "description": "When resetsObserved was measured. An unmeasured claim is prose again."
        }
      },
      "additionalProperties": false
    },
    "quality": {
      "type": "object",
      "description": "Optional next/-only attribute facet (FR-SDC2). OPC-UA StatusCode/Quality propagation policy — today the source StatusCode is discarded at the edge. 'onBad' = edge behaviour when source quality is not Good: drop|flag|hold; 'nullFlavor' = HL7/ISO null-flavor token. Optional everywhere; absent = legacy forward-as-is.",
      "properties": {
        "onBad": {
          "type": "string",
          "enum": [
            "drop",
            "flag",
            "hold"
          ]
        },
        "nullFlavor": {
          "type": "string"
        }
      },
      "additionalProperties": false
    },
    "semantics": {
      "description": "Optional next/-only facet (FR-SDC3). IRI reference(s) grounding this profile/attribute in an external vocabulary (CESMII SM, ISO/IEC, BFO, …) for KG-Builder node enrichment. Single prefixed IRI string, array of them, or object form ({ $ref, sameAs[] }). Skeleton-first: absent is valid.",
      "oneOf": [
        {
          "$ref": "#/definitions/iri"
        },
        {
          "type": "array",
          "items": {
            "$ref": "#/definitions/iri"
          },
          "minItems": 0
        },
        {
          "type": "object",
          "properties": {
            "$ref": {
              "$ref": "#/definitions/iri"
            },
            "sameAs": {
              "type": "array",
              "items": {
                "$ref": "#/definitions/iri"
              }
            },
            "label": {
              "type": "string"
            }
          },
          "additionalProperties": false
        }
      ]
    },
    "iri": {
      "type": "string",
      "pattern": "^(cesmii|iso|iec|bfo|qudt|unece|sosa|ssn|saref|om|skos|rdfs|owl):[A-Za-z0-9_./#-]+$|^https?://[^\\s]+$"
    }
  }
}
