{
  "profileId": "SMProfile-OperationsResponse",
  "version": "2.3.0",
  "standard": "CESMII",
  "category": "business",
  "displayName": "Operations Response (production actuals / confirmation)",
  "description": "Level-3 MOM OperationsResponse = the manufacturing actuals (B2MML OperationsPerformance). Full text: docs/history/standard/profiles/erp/operations-response.md, description.",
  "parentType": "Response",
  "abstract": false,
  "attributes": [
    {
      "name": "production_order_no",
      "dataType": "String",
      "required": true,
      "category": "Core",
      "description": "Join key — the OperationsRequest whose actuals this confirms (RESPONDS_TO).",
      "delivery": "transactional",
      "scope": "hub",
      "promotion": "on_change",
      "valueType": "ID"
    },
    {
      "name": "article_ref",
      "dataType": "String",
      "required": false,
      "category": "Link",
      "description": "Manufactured article (join key to Article).",
      "delivery": "transactional",
      "scope": "hub",
      "promotion": "on_change",
      "valueType": "ID"
    },
    {
      "name": "machine_ref",
      "dataType": "String",
      "required": false,
      "category": "Link",
      "description": "Executing machine / line (machine_no).",
      "delivery": "transactional",
      "scope": "hub",
      "promotion": "on_change",
      "valueType": "ID"
    },
    {
      "name": "quantity_produced",
      "dataType": "Int32",
      "required": false,
      "category": "Execution",
      "description": "Piece count actually produced (actual). Counterpart to qty_planned.",
      "delivery": "transactional",
      "scope": "hub",
      "promotion": "on_change",
      "quality": {
        "onBad": "flag"
      }
    },
    {
      "name": "cycle_time_actual_sec",
      "dataType": "Double",
      "required": false,
      "category": "Execution",
      "description": "Actually measured cycle time per piece (s, actual).",
      "delivery": "transactional",
      "scope": "hub",
      "promotion": "on_change",
      "quality": {
        "onBad": "flag"
      }
    },
    {
      "name": "actual_end_time",
      "dataType": "DateTime",
      "required": false,
      "category": "Timing",
      "description": "Actual completion time (actual). Counterpart to planned_end_time.",
      "delivery": "transactional",
      "scope": "hub",
      "promotion": "on_change",
      "quality": {
        "onBad": "flag"
      }
    },
    {
      "name": "status",
      "dataType": "String",
      "required": false,
      "category": "Core",
      "description": "Actual status of the confirmation. Full text: docs/history/standard/profiles/erp/operations-response.md, attributes › status › description.",
      "enum": [
        "in_arbeit",
        "fertig"
      ],
      "delivery": "transactional",
      "scope": "hub",
      "promotion": "on_change",
      "quality": {
        "onBad": "flag"
      }
    },
    {
      "name": "completed_at",
      "dataType": "DateTime",
      "required": false,
      "category": "Timing",
      "description": "Completion timestamp of the confirmation, if set.",
      "delivery": "transactional",
      "scope": "hub",
      "promotion": "on_change"
    },
    {
      "name": "updated_at",
      "dataType": "DateTime",
      "required": false,
      "category": "Timing",
      "description": "Last change. Server-managed and volatile on every read (sim-v5 returns a fresh value per GET), so promotion:never — kept in the snapshot but excluded from the change-trigger and never published on its own.",
      "delivery": "transactional",
      "scope": "hub",
      "promotion": "never"
    }
  ],
  "relationships": [
    {
      "type": "MADE_UP_OF",
      "target": "SegmentResponse",
      "description": "v2.0 — Inverse of SegmentResponse.PART_OF: the actuals per ProcessSegment.",
      "targetIdProp": "segment_response_no"
    }
  ],
  "constraints": [],
  "semantics": [],
  "kpiRefs": [],
  "isa95": {
    "objectModel": "OperationsResponse",
    "part": 2,
    "momDomain": "production",
    "level": 3,
    "note": "Level-3 MOM OperationsResponse (B2MML) = the actuals. Full text: docs/history/standard/profiles/erp/operations-response.md, isa95 › note.",
    "propertyMap": {
      "production_order_no": "OperationsResponse.OperationsRequestID",
      "article_ref": "OperationsResponse.SegmentResponse.MaterialActual.MaterialDefinitionID",
      "machine_ref": "OperationsResponse.SegmentResponse.EquipmentActual.EquipmentID",
      "quantity_produced": "OperationsResponse.SegmentResponse.MaterialActual.Quantity",
      "actual_end_time": "OperationsResponse.EndTime",
      "status": "OperationsResponse.ResponseState"
    }
  },
  "kgNodeLabel": "OperationsResponse",
  "kgIdProperty": "production_order_no"
}
